{"$schema":"http://json-schema.org/draft-07/schema#","$id":"https://agentic-website-studio.local/schemas/m43r-revision-contract.schema.json","type":"object","required":["schemaVersion","contractId","bindings","acts","tradeoffContract","journey","motion","preservation","supportBoundary","humanGate"],"properties":{"schemaVersion":{"const":"1.0.0"},"contractId":{"const":"revision_contract_wayfinder_m43r_full_journey_01"},"projectId":{"type":"string"},"milestone":{"const":"M4.3R"},"bindings":{"type":"object"},"revisionThesis":{"type":"string"},"acts":{"type":"array","minItems":3,"maxItems":3},"tradeoffContract":{"type":"object"},"journey":{"type":"object"},"motion":{"type":"object"},"preservation":{"type":"object"},"supportBoundary":{"type":"object"},"humanGate":{"type":"object","properties":{"requiredStatus":{"const":"pending_human_expansion_replaytest"}}}}}
